日期Date,指数代码 Index Code,指数名称 Index Name,指数英文名称Index Name(Eng),成分券代码Constituent Code,成分券名称Constituent Name,成分券英文名称Constituent Name(Eng),交易所Exchange,交易所英文名称Exchange(Eng),权重(%)weight
20220831,000300,沪深300,CSI 300,300014,亿纬锂能,Eve Energy Co Ltd,深圳证券交易所,Shenzhen  Exchange,0.563
20220831,000300,沪深300,CSI 300,300015,爱尔眼科,Aier Eye Hospital Group Co Ltd,深圳证券交易所,Shenzhen  Exchange,0.542
20220831,000300,沪深300,CSI 300,600150,中国船舶,China CSSC Holdings Limited,上海证券交易所,Shanghai  Exchange,0.235
20220831,000300,沪深300,CSI 300,600161,天坛生物,Beijing Tiantan Biological Products Co Ltd,上海证券交易所,Shanghai  Exchange,0.096
20220831,000300,沪深300,CSI 300,600188,兖矿能源,Yankuang Energy Group Company Limited,上海证券交易所,Shanghai  Exchange,0.23
20220831,000300,沪深300,CSI 300,600900,长江电力,China Yangtze Power Co Ltd,上海证券交易所,Shanghai  Exchange,1.427
20220831,000300,沪深300,CSI 300,600332,白云山,GUANGZHOU BAIYUNSHAN PHARMACEUTICAL HOLDINGS COMPANY LIMITED,上海证券交易所,Shanghai  Exchange,0.1
20220831,000300,沪深300,CSI 300,600010,包钢股份,Inner Mongolia Baotou Steel Union Co Ltd,上海证券交易所,Shanghai  Exchange,0.24
20220831,000300,沪深300,CSI 300,600176,中国巨石,"CHINA JUSHI CO., LTD.",上海证券交易所,Shanghai  Exchange,0.181
20220831,000300,沪深300,CSI 300,600600,青岛啤酒,Tsingtao Brewery Co Ltd,上海证券交易所,Shanghai  Exchange,0.201
20220831,000300,沪深300,CSI 300,600690,海尔智家,"Haier Smart Home Co., Ltd.",上海证券交易所,Shanghai  Exchange,0.513
20220831,000300,沪深300,CSI 300,600028,中国石化,China Petroleum & Chemical Corporation,上海证券交易所,Shanghai  Exchange,0.299
20220831,000300,沪深300,CSI 300,600346,恒力石化,"Hengli Petrochemical Co.,Ltd.",上海证券交易所,Shanghai  Exchange,0.212
20220831,000300,沪深300,CSI 300,002120,韵达股份,"YUNDA Holding CO., Ltd.",深圳证券交易所,Shenzhen  Exchange,0.128
20220831,000300,沪深300,CSI 300,601390,中国中铁,China Railway Group Limited,上海证券交易所,Shanghai  Exchange,0.309
20220831,000300,沪深300,CSI 300,601618,中国中冶,Metallurgical Corporation of China Co Ltd,上海证券交易所,Shanghai  Exchange,0.12
20220831,000300,沪深300,CSI 300,600219,南山铝业,"Shandong Nanshan Aluminium Co., Ltd.",上海证券交易所,Shanghai  Exchange,0.127
20220831,000300,沪深300,CSI 300,600837,海通证券,Haitong Securities Company Limited,上海证券交易所,Shanghai  Exchange,0.479
20220831,000300,沪深300,CSI 300,600132,重庆啤酒,Chongqing Brewery Co Ltd,上海证券交易所,Shanghai  Exchange,0.142
20220831,000300,沪深300,CSI 300,600115,中国东航,"China Eastern Airlines Co., Ltd.",上海证券交易所,Shanghai  Exchange,0.141
20220831,000300,沪深300,CSI 300,600104,上汽集团,SAIC Motor Co Ltd,上海证券交易所,Shanghai  Exchange,0.378
20220831,000300,沪深300,CSI 300,600031,三一重工,Sany Heavy Industry Co Ltd,上海证券交易所,Shanghai  Exchange,0.49
20220831,000300,沪深300,CSI 300,600352,浙江龙盛,Zhejiang Longsheng Group Co Ltd,上海证券交易所,Shanghai  Exchange,0.13
20220831,000300,沪深300,CSI 300,000977,浪潮信息,"Inspur Electronic Information Industry Co.,Ltd",深圳证券交易所,Shenzhen  Exchange,0.124
20220831,000300,沪深300,CSI 300,002202,金风科技,Xinjiang Goldwind Science & Technology Co Ltd,深圳证券交易所,Shenzhen  Exchange,0.185
20220831,000300,沪深300,CSI 300,300059,东方财富,East Money Information Co Ltd,深圳证券交易所,Shenzhen  Exchange,1.229
20220831,000300,沪深300,CSI 300,601818,光大银行,China Everbright Bank Co Ltd,上海证券交易所,Shanghai  Exchange,0.249
20220831,000300,沪深300,CSI 300,600406,国电南瑞,"NARI Technology Co., Ltd.",上海证券交易所,Shanghai  Exchange,0.481
20220831,000300,沪深300,CSI 300,600760,中航沈飞,AVIC SHENYANG AIRCRAFT COMPANY LIMITED,上海证券交易所,Shanghai  Exchange,0.241
20220831,000300,沪深300,CSI 300,600795,国电电力,GD Power Development Co Ltd,上海证券交易所,Shanghai  Exchange,0.203
20220831,000300,沪深300,CSI 300,600061,国投资本,"SDIC Capital Co., Ltd",上海证券交易所,Shanghai  Exchange,0.088
20220831,000300,沪深300,CSI 300,600309,万华化学,"Wanhua Chemical Group Co., Ltd.",上海证券交易所,Shanghai  Exchange,0.728
20220831,000300,沪深300,CSI 300,600111,北方稀土,"China Northern Rare Earth (Group) High-Tech Co.,Ltd",上海证券交易所,Shanghai  Exchange,0.344
20220831,000300,沪深300,CSI 300,600655,豫园股份,"SHANGHAI YUYUAN TOURIST MART (GROUP) CO., LTD.",上海证券交易所,Shanghai  Exchange,0.065
20220831,000300,沪深300,CSI 300,600809,山西汾酒,Shanxi Xinghuacun Fen Wine Factory Co Ltd,上海证券交易所,Shanghai  Exchange,0.749
20220831,000300,沪深300,CSI 300,600460,士兰微,Hangzhou Silan Microelectronics Co Ltd,上海证券交易所,Shanghai  Exchange,0.176
20220831,000300,沪深300,CSI 300,600030,中信证券,CITIC Securities Co Ltd,上海证券交易所,Shanghai  Exchange,0.997
20220831,000300,沪深300,CSI 300,600362,江西铜业,Jiangxi Copper Co Ltd,上海证券交易所,Shanghai  Exchange,0.089
20220831,000300,沪深300,CSI 300,600585,海螺水泥,Anhui Conch Cement Co Ltd,上海证券交易所,Shanghai  Exchange,0.401
20220831,000300,沪深300,CSI 300,600036,招商银行,China Merchants Bank Co Ltd,上海证券交易所,Shanghai  Exchange,2.271
20220831,000300,沪深300,CSI 300,000768,中航西飞,AVIC XI'AN AIRCRAFT INDUSTRY GROUP COMPANY LTD.,深圳证券交易所,Shenzhen  Exchange,0.202
20220831,000300,沪深300,CSI 300,000776,广发证券,"GF Securities Co., Ltd.",深圳证券交易所,Shenzhen  Exchange,0.255
20220831,000300,沪深300,CSI 300,000792,盐湖股份,Qinghai Salt Lake Industry Co Ltd,深圳证券交易所,Shenzhen  Exchange,0.633
20220831,000300,沪深300,CSI 300,600519,贵州茅台,Kweichow Moutai Co Ltd,上海证券交易所,Shanghai  Exchange,6.326
20220831,000300,沪深300,CSI 300,600089,特变电工,TBEA Co Ltd,上海证券交易所,Shanghai  Exchange,0.492
20220831,000300,沪深300,CSI 300,600887,伊利股份,Inner Mongolia Yili Industrial Group Co Ltd,上海证券交易所,Shanghai  Exchange,0.958
20220831,000300,沪深300,CSI 300,600893,航发动力,AVIC AVIATION ENGINE CORPORATION PLC.,上海证券交易所,Shanghai  Exchange,0.321
20220831,000300,沪深300,CSI 300,600050,中国联通,China United Network Communications Co Ltd,上海证券交易所,Shanghai  Exchange,0.346
20220831,000300,沪深300,CSI 300,600085,同仁堂,Beijing Tongrentang Co Ltd,上海证券交易所,Shanghai  Exchange,0.168
20220831,000300,沪深300,CSI 300,300142,沃森生物,Walvax Biotechnology Co Ltd,深圳证券交易所,Shenzhen  Exchange,0.366
20220831,000300,沪深300,CSI 300,000651,格力电器,"Gree Electric Appliances,Inc. of Zhuhai",深圳证券交易所,Shenzhen  Exchange,0.791
20220831,000300,沪深300,CSI 300,000661,长春高新,Chang Chun High and New Technology Industry (Group) Inc.,深圳证券交易所,Shenzhen  Exchange,0.3
20220831,000300,沪深300,CSI 300,000703,恒逸石化,Hengyi Petrochemical Co Ltd,深圳证券交易所,Shenzhen  Exchange,0.104
20220831,000300,沪深300,CSI 300,000708,中信特钢,"CITIC Pacific Special Steel Group Co., Ltd",深圳证券交易所,Shenzhen  Exchange,0.104
20220831,000300,沪深300,CSI 300,000858,五 粮 液,Wuliangye Yibin Co Ltd,深圳证券交易所,Shenzhen  Exchange,1.699
20220831,000300,沪深300,CSI 300,002027,分众传媒,"Focus Media Information Technology Co., Ltd.",深圳证券交易所,Shenzhen  Exchange,0.321
20220831,000300,沪深300,CSI 300,002032,苏泊尔,"Zhejiang Supor Co.,Ltd",深圳证券交易所,Shenzhen  Exchange,0.039
20220831,000300,沪深300,CSI 300,002050,三花智控,"ZHEJIANG SANHUA INTELLIGENT CONTROLS CO.,LTD.",深圳证券交易所,Shenzhen  Exchange,0.241
20220831,000300,沪深300,CSI 300,600048,保利发展,"Poly Developments and Holdings Group Co., Ltd.",上海证券交易所,Shanghai  Exchange,0.65
20220831,000300,沪深300,CSI 300,601398,工商银行,Industrial and Commercial Bank of China Ltd,上海证券交易所,Shanghai  Exchange,0.804
20220831,000300,沪深300,CSI 300,002236,大华股份,Zhejiang Dahua Technology Co Ltd,深圳证券交易所,Shenzhen  Exchange,0.139
20220831,000300,沪深300,CSI 300,601111,中国国航,Air China Ltd,上海证券交易所,Shanghai  Exchange,0.161
20220831,000300,沪深300,CSI 300,002064,华峰化学,"Huafon Chemical Co., Ltd.",深圳证券交易所,Shenzhen  Exchange,0.059
20220831,000300,沪深300,CSI 300,002271,东方雨虹,Beijing Oriental Yuhong Waterproof Technology Co Ltd,深圳证券交易所,Shenzhen  Exchange,0.32
20220831,000300,沪深300,CSI 300,002475,立讯精密,"Luxshare Precision Industry Co., Ltd.",深圳证券交易所,Shenzhen  Exchange,0.974
20220831,000300,沪深300,CSI 300,000876,新 希 望,"NEW HOPE LIUHE CO., LTD",深圳证券交易所,Shenzhen  Exchange,0.185
20220831,000300,沪深300,CSI 300,601088,中国神华,China Shenhua Energy Co Ltd,上海证券交易所,Shanghai  Exchange,0.524
20220831,000300,沪深300,CSI 300,601766,中国中车,CRRC Corporation Limited,上海证券交易所,Shanghai  Exchange,0.319
20220831,000300,沪深300,CSI 300,601668,中国建筑,China State Construction Engineering Co Ltd,上海证券交易所,Shanghai  Exchange,0.564
20220831,000300,沪深300,CSI 300,002304,洋河股份,Jiangsu Yanghe Brewery Joint-Stock Co Ltd,深圳证券交易所,Shenzhen  Exchange,0.519
20220831,000300,沪深300,CSI 300,601688,华泰证券,Huatai Securities Co Ltd,上海证券交易所,Shanghai  Exchange,0.405
20220831,000300,沪深300,CSI 300,601628,中国人寿,China Life Insurance Company Limited,上海证券交易所,Shanghai  Exchange,0.268
20220831,000300,沪深300,CSI 300,000100,TCL科技,TCL Technology Group Corporation,深圳证券交易所,Shenzhen  Exchange,0.305
20220831,000300,沪深300,CSI 300,600438,通威股份,Tongwei Co Ltd,上海证券交易所,Shanghai  Exchange,0.748
20220831,000300,沪深300,CSI 300,601988,中国银行,Bank of China Ltd,上海证券交易所,Shanghai  Exchange,0.335
20220831,000300,沪深300,CSI 300,601808,中海油服,China Oilfield Services Limited,上海证券交易所,Shanghai  Exchange,0.045
20220831,000300,沪深300,CSI 300,601288,农业银行,Agricultural Bank of China Co Ltd,上海证券交易所,Shanghai  Exchange,0.476
20220831,000300,沪深300,CSI 300,000786,北新建材,Beijing New Building Materials Public Ltd Co,深圳证券交易所,Shenzhen  Exchange,0.14
20220831,000300,沪深300,CSI 300,600745,闻泰科技,"Wingtech Technology Co.,Ltd.",上海证券交易所,Shanghai  Exchange,0.253
20220831,000300,沪深300,CSI 300,002008,大族激光,"Han's Laser Technology Industry Group Co., Ltd.",深圳证券交易所,Shenzhen  Exchange,0.131
20220831,000300,沪深300,CSI 300,002007,华兰生物,Hualan Biological Engineering INC,深圳证券交易所,Shenzhen  Exchange,0.113
20220831,000300,沪深300,CSI 300,002001,新和成,Zhejiang NHU Co Ltd,深圳证券交易所,Shenzhen  Exchange,0.218
20220831,000300,沪深300,CSI 300,002049,紫光国微,"Unigroup Guoxin Microelectronics Co., Ltd.",深圳证券交易所,Shenzhen  Exchange,0.486
20220831,000300,沪深300,CSI 300,601898,中煤能源,China Coal Energy Co Ltd,上海证券交易所,Shanghai  Exchange,0.096
20220831,000300,沪深300,CSI 300,601117,中国化学,China National Chemical Engineering Co Ltd,上海证券交易所,Shanghai  Exchange,0.165
20220831,000300,沪深300,CSI 300,601919,中远海控,"COSCO SHIPPING Holdings Co., Ltd.",上海证券交易所,Shanghai  Exchange,0.471
20220831,000300,沪深300,CSI 300,300122,智飞生物,Chongqing Zhifei Biological Products Co Ltd,深圳证券交易所,Shenzhen  Exchange,0.394
20220831,000300,沪深300,CSI 300,300124,汇川技术,Shenzhen Inovance Technology Co Ltd,深圳证券交易所,Shenzhen  Exchange,0.579
20220831,000300,沪深300,CSI 300,600018,上港集团,Shanghai International Port (Group) Co Ltd,上海证券交易所,Shanghai  Exchange,0.092
20220831,000300,沪深300,CSI 300,600183,生益科技,"Shengyi Technology Co.,Ltd.",上海证券交易所,Shanghai  Exchange,0.096
20220831,000300,沪深300,CSI 300,600763,通策医疗,TOPCHOICE MEDICAL CORPORATION,上海证券交易所,Shanghai  Exchange,0.137
20220831,000300,沪深300,CSI 300,600383,金地集团,Gemdale Corporation,上海证券交易所,Shanghai  Exchange,0.165
20220831,000300,沪深300,CSI 300,600588,用友网络,"Yonyou Network Technology Co., Ltd.",上海证券交易所,Shanghai  Exchange,0.181
20220831,000300,沪深300,CSI 300,600019,宝钢股份,Baoshan Iron &Steel Co Ltd,上海证券交易所,Shanghai  Exchange,0.249
20220831,000300,沪深300,CSI 300,600016,民生银行,China Minsheng Banking Corp Ltd,上海证券交易所,Shanghai  Exchange,0.468
20220831,000300,沪深300,CSI 300,600009,上海机场,Shanghai International Airport Co Ltd,上海证券交易所,Shanghai  Exchange,0.279
20220831,000300,沪深300,CSI 300,600011,华能国际,Huaneng Power International Inc,上海证券交易所,Shanghai  Exchange,0.188
20220831,000300,沪深300,CSI 300,002459,晶澳科技,"JA Solar Technology Co., Ltd.",深圳证券交易所,Shenzhen  Exchange,0.322
20220831,000300,沪深300,CSI 300,002460,赣锋锂业,Ganfeng Lithium Co Ltd,深圳证券交易所,Shenzhen  Exchange,0.505
20220831,000300,沪深300,CSI 300,000338,潍柴动力,Wei Chai Power Co Ltd,深圳证券交易所,Shenzhen  Exchange,0.33
20220831,000300,沪深300,CSI 300,601998,中信银行,China Citic Bank Corporation Limited,上海证券交易所,Shanghai  Exchange,0.072
20220831,000300,沪深300,CSI 300,601600,中国铝业,Aluminum Corporation of China Limited,上海证券交易所,Shanghai  Exchange,0.185
20220831,000300,沪深300,CSI 300,600196,复星医药,Shanghai Fosun Pharmaceutical (Group) Co Ltd,上海证券交易所,Shanghai  Exchange,0.268
20220831,000300,沪深300,CSI 300,600276,恒瑞医药,Jiangsu Hengrui Medicine Co Ltd,上海证券交易所,Shanghai  Exchange,0.81
20220831,000300,沪深300,CSI 300,600000,浦发银行,Shanghai Pudong Development Bank Co Ltd,上海证券交易所,Shanghai  Exchange,0.447
20220831,000300,沪深300,CSI 300,600426,华鲁恒升,Shandong Hualu-Hengsheng Chemical Co Ltd,上海证券交易所,Shanghai  Exchange,0.227
20220831,000300,沪深300,CSI 300,601899,紫金矿业,Zijin Mining Group Co Ltd,上海证券交易所,Shanghai  Exchange,0.664
20220831,000300,沪深300,CSI 300,002493,荣盛石化,Rongsheng Petro Chemical Co Ltd,深圳证券交易所,Shenzhen  Exchange,0.225
20220831,000300,沪深300,CSI 300,002466,天齐锂业,"Tianqi Lithium Industries, Inc.",深圳证券交易所,Shenzhen  Exchange,0.618
20220831,000300,沪深300,CSI 300,601888,中国中免,China Tourism Group Duty Free Corporation Limited,上海证券交易所,Shanghai  Exchange,0.999
20220831,000300,沪深300,CSI 300,002410,广联达,Glodon Software Co Ltd,深圳证券交易所,Shenzhen  Exchange,0.245
20220831,000300,沪深300,CSI 300,601877,正泰电器,Zhejiang Chint Electrics Co Ltd,上海证券交易所,Shanghai  Exchange,0.178
20220831,000300,沪深300,CSI 300,300003,乐普医疗,Lepu Medical Technology (Beijing) Co Ltd,深圳证券交易所,Shenzhen  Exchange,0.125
20220831,000300,沪深300,CSI 300,002230,科大讯飞,"Iflytek Co.,Ltd.",深圳证券交易所,Shenzhen  Exchange,0.365
20220831,000300,沪深300,CSI 300,601166,兴业银行,Industrial Bank,上海证券交易所,Shanghai  Exchange,1.303
20220831,000300,沪深300,CSI 300,601601,中国太保,China Pacific Insurance (Group) Co Ltd,上海证券交易所,Shanghai  Exchange,0.376
20220831,000300,沪深300,CSI 300,600999,招商证券,China Merchants Securities Co Ltd,上海证券交易所,Shanghai  Exchange,0.257
20220831,000300,沪深300,CSI 300,002414,高德红外,Wuhan Guide Infrared Co Ltd,深圳证券交易所,Shenzhen  Exchange,0.098
20220831,000300,沪深300,CSI 300,002179,中航光电,"AVIC Jonhon Optronic Technology Co.,Ltd.",深圳证券交易所,Shenzhen  Exchange,0.253
20220831,000300,沪深300,CSI 300,601788,光大证券,Everbright Securities Co Ltd,上海证券交易所,Shanghai  Exchange,0.164
20220831,000300,沪深300,CSI 300,002142,宁波银行,Bank of Ningbo Co Ltd,深圳证券交易所,Shenzhen  Exchange,0.619
20220831,000300,沪深300,CSI 300,601009,南京银行,Bank of Nanjing Co Ltd,上海证券交易所,Shanghai  Exchange,0.286
20220831,000300,沪深300,CSI 300,002074,国轩高科,"GUOXUAN HIGH-TECH CO.,LTD.",深圳证券交易所,Shenzhen  Exchange,0.192
20220831,000300,沪深300,CSI 300,600606,绿地控股,Greenland Holdings Corporation Limited,上海证券交易所,Shanghai  Exchange,0.069
20220831,000300,沪深300,CSI 300,600660,福耀玻璃,"Fuyao Glass Industry Group Co.,Ltd",上海证券交易所,Shanghai  Exchange,0.328
20220831,000300,沪深300,CSI 300,600741,华域汽车,HUAYU Automotive Systems Company Limited,上海证券交易所,Shanghai  Exchange,0.154
20220831,000300,沪深300,CSI 300,600845,宝信软件,Shanghai Baosight Software Co Ltd,上海证券交易所,Shanghai  Exchange,0.117
20220831,000300,沪深300,CSI 300,600886,国投电力,"SDIC Power Holdings Co.,Ltd.",上海证券交易所,Shanghai  Exchange,0.174
20220831,000300,沪深300,CSI 300,002352,顺丰控股,"S.F. Holding Co., Ltd.",深圳证券交易所,Shenzhen  Exchange,0.507
20220831,000300,沪深300,CSI 300,002252,上海莱士,Shanghai RAAS Blood Products Co Ltd,深圳证券交易所,Shenzhen  Exchange,0.124
20220831,000300,沪深300,CSI 300,601989,中国重工,China Shipbuilding Industry Co Ltd,上海证券交易所,Shanghai  Exchange,0.226
20220831,000300,沪深300,CSI 300,300033,同花顺,"Hithink Royalflush Information Network Co.,Ltd.",深圳证券交易所,Shenzhen  Exchange,0.096
20220831,000300,沪深300,CSI 300,601857,中国石油,PetroChina Co Ltd,上海证券交易所,Shanghai  Exchange,0.272
20220831,000300,沪深300,CSI 300,601186,中国铁建,China Railway Construction Co Ltd,上海证券交易所,Shanghai  Exchange,0.179
20220831,000300,沪深300,CSI 300,601939,建设银行,China Construction Bank,上海证券交易所,Shanghai  Exchange,0.194
20220831,000300,沪深300,CSI 300,601318,中国平安,Ping An Insurance (Group) Company of China Ltd,上海证券交易所,Shanghai  Exchange,2.486
20220831,000300,沪深300,CSI 300,002129,TCL中环,"TCL Zhonghuan Renewable Energy Technology Co., Ltd.",深圳证券交易所,Shenzhen  Exchange,0.57
20220831,000300,沪深300,CSI 300,601006,大秦铁路,Daqin Railway Co Ltd,上海证券交易所,Shanghai  Exchange,0.201
20220831,000300,沪深300,CSI 300,002415,海康威视,Hangzhou Hikvision Digital Technology Co Ltd,深圳证券交易所,Shenzhen  Exchange,0.738
20220831,000300,沪深300,CSI 300,601377,兴业证券,Industrial Securities Co Ltd,上海证券交易所,Shanghai  Exchange,0.226
20220831,000300,沪深300,CSI 300,000800,一汽解放,"FAW Jiefang Group Co., Ltd",深圳证券交易所,Shenzhen  Exchange,0.04
20220831,000300,沪深300,CSI 300,002371,北方华创,"NAURA Technology Group Co.,Ltd.",深圳证券交易所,Shenzhen  Exchange,0.389
20220831,000300,沪深300,CSI 300,002241,歌尔股份,GoerTek Inc,深圳证券交易所,Shenzhen  Exchange,0.407
20220831,000300,沪深300,CSI 300,002311,海大集团,Guangdong Haid Group Co Ltd,深圳证券交易所,Shenzhen  Exchange,0.265
20220831,000300,沪深300,CSI 300,601328,交通银行,Bank of Communications Co LTD,上海证券交易所,Shanghai  Exchange,0.659
20220831,000300,沪深300,CSI 300,601169,北京银行,Bank of Beijing Co Ltd,上海证券交易所,Shanghai  Exchange,0.32
20220831,000300,沪深300,CSI 300,000877,天山股份,Xinjiang Tianshan Cement Co Ltd,深圳证券交易所,Shenzhen  Exchange,0.031
20220831,000300,沪深300,CSI 300,000895,双汇发展,Henan Shuanghui Investment & Development Co Ltd,深圳证券交易所,Shenzhen  Exchange,0.243
20220831,000300,沪深300,CSI 300,000938,紫光股份,"Unisplendour Co., Ltd.",深圳证券交易所,Shenzhen  Exchange,0.13
20220831,000300,沪深300,CSI 300,600547,山东黄金,Shandong Gold-Mining Co Ltd,上海证券交易所,Shanghai  Exchange,0.169
20220831,000300,沪深300,CSI 300,600015,华夏银行,Hua Xia Bank Co Ltd,上海证券交易所,Shanghai  Exchange,0.166
20220831,000300,沪深300,CSI 300,600436,片仔癀,Zhangzhou Pientzehuang Pharmaceutical Co Ltd,上海证券交易所,Shanghai  Exchange,0.475
20220831,000300,沪深300,CSI 300,600029,南方航空,China Southern Airlines Co Ltd,上海证券交易所,Shanghai  Exchange,0.171
20220831,000300,沪深300,CSI 300,600584,长电科技,"JCET Group Co., Ltd.",上海证券交易所,Shanghai  Exchange,0.185
20220831,000300,沪深300,CSI 300,600489,中金黄金,Zhongjin Gold Co Ltd,上海证券交易所,Shanghai  Exchange,0.112
20220831,000300,沪深300,CSI 300,601799,星宇股份,Changzhou Xingyu Automotive Lighting Systems Co Ltd,上海证券交易所,Shanghai  Exchange,0.105
20220831,000300,沪深300,CSI 300,000963,华东医药,Huadong Medicine Co Ltd,深圳证券交易所,Shenzhen  Exchange,0.193
20220831,000300,沪深300,CSI 300,600570,恒生电子,Hundsun Technologies Inc.,上海证券交易所,Shanghai  Exchange,0.268
20220831,000300,沪深300,CSI 300,601336,新华保险,New China Life Insurance Co Ltd,上海证券交易所,Shanghai  Exchange,0.126
20220831,000300,沪深300,CSI 300,000425,徐工机械,XCMG Construction Machinery Co Ltd,深圳证券交易所,Shenzhen  Exchange,0.161
20220831,000300,沪深300,CSI 300,300207,欣旺达,Sunwoda Electronic Co Ltd,深圳证券交易所,Shenzhen  Exchange,0.172
20220831,000300,沪深300,CSI 300,002555,三七互娱,"WUHU SANQI INTERACTIVE ENTERTAINMENT NETWORK TECHNOLOGY GROUP CO.,LTD.",深圳证券交易所,Shenzhen  Exchange,0.142
20220831,000300,沪深300,CSI 300,002594,比亚迪,BYD Co Ltd,深圳证券交易所,Shenzhen  Exchange,1.367
20220831,000300,沪深300,CSI 300,002602,世纪华通,"ZHEJIANG CENTURY HUATONG GROUP CO., LTD",深圳证券交易所,Shenzhen  Exchange,0.107
20220831,000300,沪深300,CSI 300,601901,方正证券,Founder Securities Co Ltd,上海证券交易所,Shanghai  Exchange,0.15
20220831,000300,沪深300,CSI 300,002607,中公教育,"Offcn Education Technology Co., Ltd.",深圳证券交易所,Shenzhen  Exchange,0.044
20220831,000300,沪深300,CSI 300,300223,北京君正,Ingenic Semiconductor Co Ltd,深圳证券交易所,Shenzhen  Exchange,0.082
20220831,000300,沪深300,CSI 300,002600,领益智造,LINGYI iTECH (GUANGDONG) COMPANY,深圳证券交易所,Shenzhen  Exchange,0.081
20220831,000300,沪深300,CSI 300,002601,龙佰集团,"LB Group Co., Ltd.",深圳证券交易所,Shenzhen  Exchange,0.131
20220831,000300,沪深300,CSI 300,601216,君正集团,"Inner Mongolia Junzheng Energy & Chemical Group Co.,Ltd.",上海证券交易所,Shanghai  Exchange,0.077
20220831,000300,沪深300,CSI 300,002568,百润股份,"SHANGHAI BAIRUN INVESTMENT HOLDING GROUP CO.,LTD.",深圳证券交易所,Shenzhen  Exchange,0.064
20220831,000300,沪深300,CSI 300,000596,古井贡酒,Anhui Gujing Distillery Co Ltd,深圳证券交易所,Shenzhen  Exchange,0.218
20220831,000300,沪深300,CSI 300,300316,晶盛机电,"Zhejiang Jingsheng Mechanical & Electrical Co., Ltd.",深圳证券交易所,Shenzhen  Exchange,0.256
20220831,000300,沪深300,CSI 300,601633,长城汽车,Great Wall Motor Co Ltd,上海证券交易所,Shanghai  Exchange,0.216
20220831,000300,沪深300,CSI 300,601669,中国电建,"Power Construction Corporation of China,Ltd",上海证券交易所,Shanghai  Exchange,0.309
20220831,000300,沪深300,CSI 300,601100,恒立液压,"Jiangsu Hengli Hydraulic CO., Ltd.",上海证券交易所,Shanghai  Exchange,0.134
20220831,000300,沪深300,CSI 300,300274,阳光电源,Sungrow Power Supply Co Ltd,深圳证券交易所,Shenzhen  Exchange,0.606
20220831,000300,沪深300,CSI 300,000408,藏格矿业,ZANGGE MINING COMPANY LIMITED,深圳证券交易所,Shenzhen  Exchange,0.078
20220831,000300,沪深300,CSI 300,000001,平安银行,"Ping An Bank Co., Ltd.",深圳证券交易所,Shenzhen  Exchange,0.648
20220831,000300,沪深300,CSI 300,000002,万科A,China Vanke Co Ltd,深圳证券交易所,Shenzhen  Exchange,0.593
20220831,000300,沪深300,CSI 300,000063,中兴通讯,ZTE Corporation,深圳证券交易所,Shenzhen  Exchange,0.408
20220831,000300,沪深300,CSI 300,000066,中国长城,"CHINA GREATWALL TECHNOLOGY GROUP CO., LTD.",深圳证券交易所,Shenzhen  Exchange,0.092
20220831,000300,沪深300,CSI 300,000069,华侨城A,Shenzhen Overseas Chinese Town Co Ltd,深圳证券交易所,Shenzhen  Exchange,0.115
20220831,000300,沪深300,CSI 300,000157,中联重科,Zoomlion Heavy Industry Science & Technology Co Ltd,深圳证券交易所,Shenzhen  Exchange,0.15
20220831,000300,沪深300,CSI 300,000301,东方盛虹,"Jiangsu Eastern Shenghong Co.,Ltd.",深圳证券交易所,Shenzhen  Exchange,0.18
20220831,000300,沪深300,CSI 300,000538,云南白药,"Yunnan Baiyao Group Co., Ltd.",深圳证券交易所,Shenzhen  Exchange,0.197
20220831,000300,沪深300,CSI 300,000625,长安汽车,Chongqing Changan Automobile Co Ltd,深圳证券交易所,Shenzhen  Exchange,0.378
20220831,000300,沪深300,CSI 300,000725,京东方A,BOE Technology Group Co Ltd,深圳证券交易所,Shenzhen  Exchange,0.727
20220831,000300,沪深300,CSI 300,000568,泸州老窖,Luzhou Lao Jiao Co Ltd,深圳证券交易所,Shenzhen  Exchange,0.902
20220831,000300,沪深300,CSI 300,601012,隆基绿能,"Longi Green Energy Technology Co., Ltd.",上海证券交易所,Shanghai  Exchange,1.625
